{
  "pass": "blockout",
  "attempt": 2,
  "global_score": 0.55,
  "layer_scores": {
    "silhouetteProportion": 0.8,
    "componentStructure": 0.8,
    "formDetail": 0.8,
    "materialSurface": 0.78,
    "lightingCamera": 0.78
  },
  "features": [
    {
      "id": "blockout-primary-form",
      "score": 0.5,
      "threshold": 0.75,
      "pass": false
    },
    {
      "id": "blockout-secondary-read",
      "score": 0.6,
      "threshold": 0.72,
      "pass": false
    }
  ],
  "defects": [
    "synthetic defect: primary form does not read"
  ],
  "corrections": [
    "rebuild the primary form to match the reference silhouette"
  ],
  "mechanical": {
    "console_clean": true,
    "draws": 12,
    "tris": 1400,
    "fps": 60,
    "budget_pass": true,
    "tests": {
      "command": "node --test tests/*.test.mjs",
      "pass": 5,
      "fail": 0
    }
  },
  "verdict": "FAIL",
  "action": "refine-code"
}
